{
  "$schema": "https://json-schema.org/draft/2020-12/schema",
  "title": "ModelRouting",
  "description": "Model profiles in config/models/routing.yaml (blueprint section 14.4, ADR-0027, ADR-0028). A profile pairs a registered provider with one model; its provider-specific settings follow that provider's schema in schemas/config/model-providers/. Credentials and deployment endpoints are named by environment variable, never written here. The model gateway checks the provider, the settings and uniqueness at startup and in cargo xtask validate-config.",
  "type": "object",
  "additionalProperties": false,
  "required": ["schema_version", "default_profile", "profiles", "prices"],
  "properties": {
    "schema_version": { "type": "string", "enum": ["0.2"] },
    "default_profile": {
      "description": "The profile of agents that name none. SYNTH_MODEL_PROFILE overrides it.",
      "$ref": "../common/types.schema.json#/$defs/Identifier"
    },
    "profiles": {
      "type": "array",
      "minItems": 1,
      "items": { "$ref": "#/$defs/ModelProfile" }
    },
    "prices": {
      "description": "Prices per model for cost accounting. The cost of a call to a model without a price is unknown, never zero.",
      "type": "array",
      "items": { "$ref": "#/$defs/ModelPrice" }
    }
  },
  "$defs": {
    "ModelProfile": {
      "description": "One model behind one provider, selected by name. Only the fields every provider shares are fixed here.",
      "type": "object",
      "additionalProperties": false,
      "required": [
        "name",
        "provider",
        "model",
        "tool_calling",
        "max_output_tokens",
        "request_timeout_seconds",
        "retry",
        "settings"
      ],
      "properties": {
        "name": { "$ref": "../common/types.schema.json#/$defs/Identifier" },
        "provider": {
          "description": "The name of a provider registered in the model gateway, such as anthropic or openai_compatible.",
          "$ref": "../common/types.schema.json#/$defs/Identifier"
        },
        "model": { "$ref": "../common/types.schema.json#/$defs/NonEmptyString" },
        "tool_calling": {
          "description": "False if the provider cannot return tool calls. Such a profile is refused at startup for an agent that has tools.",
          "type": "boolean"
        },
        "max_output_tokens": { "type": "integer", "minimum": 1 },
        "request_timeout_seconds": { "type": "integer", "minimum": 1 },
        "retry": { "$ref": "#/$defs/ModelRetryPolicy" },
        "settings": {
          "description": "Provider-specific settings, checked against the provider's schema in schemas/config/model-providers/.",
          "type": "object"
        }
      }
    },
    "EnvVarName": {
      "description": "The name of an environment variable. Its value is read at startup and never logged.",
      "type": "string",
      "pattern": "^[A-Z][A-Z0-9_]*$"
    },
    "ModelHeaders": {
      "description": "Extra request headers. Values are configuration, not secrets: credential and protocol headers are rejected.",
      "type": "object",
      "additionalProperties": { "type": "string", "minLength": 1 }
    },
    "ModelRetryPolicy": {
      "description": "Bounded retries of rate-limited, overloaded and timed-out calls, with exponential backoff.",
      "type": "object",
      "additionalProperties": false,
      "required": ["max_attempts", "initial_backoff_ms", "max_backoff_ms"],
      "properties": {
        "max_attempts": {
          "description": "Attempts in total, the first included.",
          "type": "integer",
          "minimum": 1,
          "maximum": 10
        },
        "initial_backoff_ms": { "type": "integer", "minimum": 0 },
        "max_backoff_ms": {
          "description": "Upper bound of every wait, including one a provider asks for.",
          "type": "integer",
          "minimum": 0
        }
      }
    },
    "ModelPrice": {
      "type": "object",
      "additionalProperties": false,
      "required": ["model", "input_usd_per_mtok", "output_usd_per_mtok"],
      "properties": {
        "model": { "$ref": "../common/types.schema.json#/$defs/NonEmptyString" },
        "input_usd_per_mtok": { "type": "number", "minimum": 0 },
        "output_usd_per_mtok": { "type": "number", "minimum": 0 }
      }
    }
  }
}
